{
  "eval_id": 1,
  "eval_name": "scoped-search",
  "prompt": "Using the supplied skill, provide an English command plan for a concrete local task: locate the literal text release-note in Markdown files inside the current authorized workspace. Existing rg is available. Read the skill and only references needed to explain the plan. Do not execute any command, create an inventory, inspect the real workspace, access the network, or install tools. Report the exact task command, necessary availability/documentation checks, and what remains unverified.",
  "assertions": [
    "Gives a concrete literal rg search limited to Markdown files in the current workspace.",
    "Checks only task-relevant tooling; no mandatory broad inventory or task-text classification.",
    "Uses doc-get for applicable approved operational guidance and distinguishes a missing source from a proposal.",
    "Makes no claim that the task command or verification actually ran."
  ]
}
