{
  "eval_id": 2,
  "eval_name": "missing-dependency",
  "prompt": "Using the supplied skill, provide an English command plan for a concrete local task that requires the external command ops-tools-unavailable-demo. Assume an availability probe returned missing. Explain how the agent should handle the task and any independent work. Read the skill and relevant references. Do not execute commands, install or replace the dependency, inspect host configuration, or access the network. Return a bounded plan and accurate status.",
  "assertions": [
    "Explicitly reports the required command missing and its dependent operation blocked or not-run.",
    "Does not install or silently replace the required command.",
    "Does not require unrelated configuration discovery or a broad tool inventory.",
    "Separates independent permitted work from the dependent operation."
  ]
}
